<!ELEMENT cataleg (single | album)+>

<!ELEMENT single (titol, descripcio?, pais, idioma, genere*, grup, membres, durada)>
<!ATTLIST single codi CDATA #REQUIRED>

<!ELEMENT album (titol, descripcio?, pais, idioma, genere*, grup, membres, numero_canco, titols_cancos)>
<!ATTLIST album codi CDATA #REQUIRED>

<!ELEMENT titol (#PCDATA)>
<!ELEMENT descripcio (#PCDATA)>
<!ELEMENT pais (#PCDATA)>
<!ELEMENT idioma (#PCDATA)>

<!ELEMENT genere (Música_clásica |Jazz |Blues |Góspel |Soul |Pop |Rock_and_Roll |Country)>
<!ELEMENT Música_clásica EMPTY>
<!ELEMENT Jazz EMPTY>
<!ELEMENT Blues EMPTY>
<!ELEMENT Góspel EMPTY>
<!ELEMENT Soul EMPTY>
<!ELEMENT Pop EMPTY>
<!ELEMENT Rock_and_Roll EMPTY>
<!ELEMENT Country EMPTY>

<!ELEMENT grup (#PCDATA)>
<!ELEMENT membres (membre+)>
<!ELEMENT membre (nom)>
<!ATTLIST membre sexe (home | dona) #REQUIRED>
<!ELEMENT nom (#PCDATA)>

<!ELEMENT durada (#PCDATA)>

<!ELEMENT numero_canco (#PCDATA)>
<!ELEMENT titols_cancos (canco+)>
<!ELEMENT canco (titol_canco, durada_canco)>
<!ATTLIST canco numero CDATA #REQUIRED>
<!ELEMENT titol_canco (#PCDATA)>
<!ELEMENT durada_canco (#PCDATA)>